{
  "$id": "https://auralume.local/contracts/auralume-theme-v1.schema.json",
  "$schema": "https://json-schema.org/draft/2020-12/schema",
  "additionalProperties": false,
  "properties": {
    "author": {
      "maxLength": 80,
      "minLength": 1,
      "pattern": "^[^\\u0000-\\u001F\\u007F-\\u009F]+$",
      "type": "string"
    },
    "colors": {
      "additionalProperties": false,
      "properties": {
        "accent": {
          "pattern": "^#[0-9A-Fa-f]{6}$",
          "type": "string"
        },
        "accent_foreground": {
          "pattern": "^#[0-9A-Fa-f]{6}$",
          "type": "string"
        },
        "accent_hover": {
          "pattern": "^#[0-9A-Fa-f]{6}$",
          "type": "string"
        },
        "background": {
          "pattern": "^#[0-9A-Fa-f]{6}$",
          "type": "string"
        },
        "border": {
          "pattern": "^#[0-9A-Fa-f]{6}$",
          "type": "string"
        },
        "card_background": {
          "pattern": "^#[0-9A-Fa-f]{6}$",
          "type": "string"
        },
        "card_hover": {
          "pattern": "^#[0-9A-Fa-f]{6}$",
          "type": "string"
        },
        "cover_end": {
          "pattern": "^#[0-9A-Fa-f]{6}$",
          "type": "string"
        },
        "cover_foreground": {
          "pattern": "^#[0-9A-Fa-f]{6}$",
          "type": "string"
        },
        "cover_middle": {
          "pattern": "^#[0-9A-Fa-f]{6}$",
          "type": "string"
        },
        "cover_start": {
          "pattern": "^#[0-9A-Fa-f]{6}$",
          "type": "string"
        },
        "error": {
          "pattern": "^#[0-9A-Fa-f]{6}$",
          "type": "string"
        },
        "focus": {
          "pattern": "^#[0-9A-Fa-f]{6}$",
          "type": "string"
        },
        "hero_end": {
          "pattern": "^#[0-9A-Fa-f]{6}$",
          "type": "string"
        },
        "hero_middle": {
          "pattern": "^#[0-9A-Fa-f]{6}$",
          "type": "string"
        },
        "hero_start": {
          "pattern": "^#[0-9A-Fa-f]{6}$",
          "type": "string"
        },
        "menu_background": {
          "pattern": "^#[0-9A-Fa-f]{6}$",
          "type": "string"
        },
        "player_background": {
          "pattern": "^#[0-9A-Fa-f]{6}$",
          "type": "string"
        },
        "selection": {
          "pattern": "^#[0-9A-Fa-f]{6}$",
          "type": "string"
        },
        "sidebar": {
          "pattern": "^#[0-9A-Fa-f]{6}$",
          "type": "string"
        },
        "slider_fill": {
          "pattern": "^#[0-9A-Fa-f]{6}$",
          "type": "string"
        },
        "slider_track": {
          "pattern": "^#[0-9A-Fa-f]{6}$",
          "type": "string"
        },
        "success": {
          "pattern": "^#[0-9A-Fa-f]{6}$",
          "type": "string"
        },
        "surface": {
          "pattern": "^#[0-9A-Fa-f]{6}$",
          "type": "string"
        },
        "surface_alt": {
          "pattern": "^#[0-9A-Fa-f]{6}$",
          "type": "string"
        },
        "text_disabled": {
          "pattern": "^#[0-9A-Fa-f]{6}$",
          "type": "string"
        },
        "text_primary": {
          "pattern": "^#[0-9A-Fa-f]{6}$",
          "type": "string"
        },
        "text_secondary": {
          "pattern": "^#[0-9A-Fa-f]{6}$",
          "type": "string"
        },
        "warning": {
          "pattern": "^#[0-9A-Fa-f]{6}$",
          "type": "string"
        }
      },
      "required": [
        "accent",
        "accent_foreground",
        "accent_hover",
        "background",
        "border",
        "card_background",
        "card_hover",
        "cover_end",
        "cover_foreground",
        "cover_middle",
        "cover_start",
        "error",
        "focus",
        "hero_end",
        "hero_middle",
        "hero_start",
        "menu_background",
        "player_background",
        "selection",
        "sidebar",
        "slider_fill",
        "slider_track",
        "success",
        "surface",
        "surface_alt",
        "text_disabled",
        "text_primary",
        "text_secondary",
        "warning"
      ],
      "type": "object"
    },
    "id": {
      "pattern": "^[a-z0-9][a-z0-9-]{0,63}$",
      "type": "string"
    },
    "name": {
      "maxLength": 60,
      "minLength": 1,
      "pattern": "^[^\\u0000-\\u001F\\u007F-\\u009F]+$",
      "type": "string"
    },
    "schema_version": {
      "const": 1,
      "type": "integer"
    }
  },
  "required": [
    "schema_version",
    "id",
    "name",
    "colors"
  ],
  "title": "Auralume theme v1",
  "type": "object"
}
