{
  "colors": {
    "accent": "#80501C",
    "accent_foreground": "#FFFFFF",
    "accent_hover": "#663D13",
    "background": "#F3F1ED",
    "border": "#C8C3BB",
    "card_background": "#FBFAF8",
    "card_hover": "#EDE8E0",
    "cover_end": "#BC7B3A",
    "cover_foreground": "#FFFFFF",
    "cover_middle": "#6476A2",
    "cover_start": "#77549B",
    "error": "#8C2929",
    "focus": "#5C3483",
    "hero_end": "#E9DDC8",
    "hero_middle": "#DDDCEB",
    "hero_start": "#E3D5E8",
    "menu_background": "#FBFAF8",
    "player_background": "#E6E2DC",
    "selection": "#D4C4E3",
    "sidebar": "#E8E5DF",
    "slider_fill": "#80501C",
    "slider_track": "#B8B2AA",
    "success": "#28623D",
    "surface": "#FBFAF8",
    "surface_alt": "#EDEAE4",
    "text_disabled": "#77737C",
    "text_primary": "#25232A",
    "text_secondary": "#57535D",
    "warning": "#76500B"
  },
  "id": "soft-daylight",
  "name": "Soft Daylight",
  "schema_version": 1
}
