{
  "colors": {
    "accent": "#E58AA8",
    "accent_foreground": "#32131F",
    "accent_hover": "#F1ADC1",
    "background": "#20151D",
    "border": "#553B4A",
    "card_background": "#2C1E29",
    "card_hover": "#3B2836",
    "cover_end": "#E8A86F",
    "cover_foreground": "#FFF2E8",
    "cover_middle": "#6A3D6C",
    "cover_start": "#A74772",
    "error": "#F3979B",
    "focus": "#F2B8CA",
    "hero_end": "#4A2B37",
    "hero_middle": "#352337",
    "hero_start": "#42263A",
    "menu_background": "#2C1E29",
    "player_background": "#180F16",
    "selection": "#553244",
    "sidebar": "#180F16",
    "slider_fill": "#E58AA8",
    "slider_track": "#5A4653",
    "success": "#8ED0A5",
    "surface": "#2C1E29",
    "surface_alt": "#35232F",
    "text_disabled": "#927B86",
    "text_primary": "#FFF1F4",
    "text_secondary": "#D0B5C0",
    "warning": "#EBCB86"
  },
  "id": "rose-velvet",
  "name": "Rose Velvet",
  "schema_version": 1
}
