{
  "author": "Comunidade Auralume",
  "colors": {
    "accent": "#DCA756",
    "accent_foreground": "#21170A",
    "accent_hover": "#E7B76B",
    "background": "#14131A",
    "border": "#393541",
    "card_background": "#1D1A24",
    "card_hover": "#282431",
    "cover_end": "#D79444",
    "cover_foreground": "#FFF5E4",
    "cover_middle": "#3F497E",
    "cover_start": "#7548A8",
    "error": "#F0A1A1",
    "focus": "#E7B76B",
    "hero_end": "#423523",
    "hero_middle": "#292637",
    "hero_start": "#34283D",
    "menu_background": "#211E29",
    "player_background": "#100F15",
    "selection": "#393047",
    "sidebar": "#100F15",
    "slider_fill": "#DCA756",
    "slider_track": "#48434F",
    "success": "#89CCA5",
    "surface": "#1D1A24",
    "surface_alt": "#25222D",
    "text_disabled": "#77717F",
    "text_primary": "#F4F0EA",
    "text_secondary": "#A7A1B0",
    "warning": "#E8CA90"
  },
  "id": "meu-auralume",
  "name": "Meu Auralume",
  "schema_version": 1
}
