{
  "colors": {
    "accent": "#69B9F2",
    "accent_foreground": "#071A28",
    "accent_hover": "#91D0FF",
    "background": "#101722",
    "border": "#334457",
    "card_background": "#182331",
    "card_hover": "#24364A",
    "cover_end": "#51A7C8",
    "cover_foreground": "#E9F7FF",
    "cover_middle": "#203D72",
    "cover_start": "#285E92",
    "error": "#F39A9A",
    "focus": "#A4D8FF",
    "hero_end": "#203C4C",
    "hero_middle": "#1A283F",
    "hero_start": "#19324B",
    "menu_background": "#182331",
    "player_background": "#0B111B",
    "selection": "#29445D",
    "sidebar": "#0B111B",
    "slider_fill": "#69B9F2",
    "slider_track": "#435367",
    "success": "#86D5A2",
    "surface": "#182331",
    "surface_alt": "#1E2B3B",
    "text_disabled": "#718096",
    "text_primary": "#F2F6FC",
    "text_secondary": "#AAB9CC",
    "warning": "#F2CE7D"
  },
  "id": "midnight-blue",
  "name": "Midnight Blue",
  "schema_version": 1
}
