{
  "colors": {
    "accent": "#8FCB8D",
    "accent_foreground": "#102112",
    "accent_hover": "#B1E3A7",
    "background": "#131A17",
    "border": "#3C5042",
    "card_background": "#1B2620",
    "card_hover": "#28392D",
    "cover_end": "#B3A75B",
    "cover_foreground": "#F4F6D8",
    "cover_middle": "#355D52",
    "cover_start": "#42775A",
    "error": "#EB9993",
    "focus": "#B7E9B2",
    "hero_end": "#3B4930",
    "hero_middle": "#20332E",
    "hero_start": "#233C2D",
    "menu_background": "#1B2620",
    "player_background": "#0D1411",
    "selection": "#2D4937",
    "sidebar": "#0D1411",
    "slider_fill": "#8FCB8D",
    "slider_track": "#4A5A4D",
    "success": "#8FCB8D",
    "surface": "#1B2620",
    "surface_alt": "#233129",
    "text_disabled": "#748277",
    "text_primary": "#F0F5F0",
    "text_secondary": "#AEBBAF",
    "warning": "#E6C982"
  },
  "id": "forest",
  "name": "Forest",
  "schema_version": 1
}
